mysql> show databases;
+--------------------+
| Database           |
+--------------------+
| fsdcwdtb19         |
| fsdcwdtb27         |
| fsdcwetb23         |
| information_schema |
| mysql              |
| performance_schema |
| sys                |
+--------------------+
7 rows in set (0.06 sec)

mysql> use fsdcwetb23
Reading table information for completion of table and column names
You can turn off this feature to get a quicker startup with -A

Database changed
mysql> select database();
+------------+
| database() |
+------------+
| fsdcwetb23 |
+------------+
1 row in set (0.00 sec)

mysql> show tables;
+----------------------+
| Tables_in_fsdcwetb23 |
+----------------------+
| Products             |
+----------------------+
1 row in set (0.00 sec)

mysql> select * from Products;
+------+-------------+-------+-----------+-----------+-------------+
| ID   | Name        | Price | Brand     | Branch    | Location    |
+------+-------------+-------+-----------+-----------+-------------+
|    1 | Pen         | 20.50 | National  | Main      | New York    |
|    2 | Pencil      | 10.50 | National  | Secondary | Los Angeles |
|    3 | Notebook    | 40.00 | Classmate | Main      | Chicago     |
|    4 | Eraser      | 10.50 | National  | Main      | Houston     |
|    5 | Marker      | 60.00 | National  | Secondary | Phoenix     |
|    7 | Ruler       | 25.00 | National  | Secondary | Los Angeles |
|    8 | Highlighter | 30.00 | National  | Main      | Chicago     |
|    9 | Glue        | 20.00 | National  | Main      | Houston     |
|   10 | Tape        | 15.00 | National  | Secondary | Phoenix     |
+------+-------------+-------+-----------+-----------+-------------+
9 rows in set (0.00 sec)

mysql> select name, price, location from Products;
+-------------+-------+-------------+
| name        | price | location    |
+-------------+-------+-------------+
| Pen         | 20.50 | New York    |
| Pencil      | 10.50 | Los Angeles |
| Notebook    | 40.00 | Chicago     |
| Eraser      | 10.50 | Houston     |
| Marker      | 60.00 | Phoenix     |
| Ruler       | 25.00 | Los Angeles |
| Highlighter | 30.00 | Chicago     |
| Glue        | 20.00 | Houston     |
| Tape        | 15.00 | Phoenix     |
+-------------+-------+-------------+
9 rows in set (0.01 sec)

mysql> select * from products;
+------+-------------+-------+-----------+-----------+-------------+
| ID   | Name        | Price | Brand     | Branch    | Location    |
+------+-------------+-------+-----------+-----------+-------------+
|    1 | Pen         | 20.50 | National  | Main      | New York    |
|    2 | Pencil      | 10.50 | National  | Secondary | Los Angeles |
|    3 | Notebook    | 40.00 | Classmate | Main      | Chicago     |
|    4 | Eraser      | 10.50 | National  | Main      | Houston     |
|    5 | Marker      | 60.00 | National  | Secondary | Phoenix     |
|    7 | Ruler       | 25.00 | National  | Secondary | Los Angeles |
|    8 | Highlighter | 30.00 | National  | Main      | Chicago     |
|    9 | Glue        | 20.00 | National  | Main      | Houston     |
|   10 | Tape        | 15.00 | National  | Secondary | Phoenix     |
+------+-------------+-------+-----------+-----------+-------------+
9 rows in set (0.00 sec)

mysql> select * from products where branch='Secondary';
+------+--------+-------+----------+-----------+-------------+
| ID   | Name   | Price | Brand    | Branch    | Location    |
+------+--------+-------+----------+-----------+-------------+
|    2 | Pencil | 10.50 | National | Secondary | Los Angeles |
|    5 | Marker | 60.00 | National | Secondary | Phoenix     |
|    7 | Ruler  | 25.00 | National | Secondary | Los Angeles |
|   10 | Tape   | 15.00 | National | Secondary | Phoenix     |
+------+--------+-------+----------+-----------+-------------+
4 rows in set (0.00 sec)

mysql> select * from products where branch='Main';
+------+-------------+-------+-----------+--------+----------+
| ID   | Name        | Price | Brand     | Branch | Location |
+------+-------------+-------+-----------+--------+----------+
|    1 | Pen         | 20.50 | National  | Main   | New York |
|    3 | Notebook    | 40.00 | Classmate | Main   | Chicago  |
|    4 | Eraser      | 10.50 | National  | Main   | Houston  |
|    8 | Highlighter | 30.00 | National  | Main   | Chicago  |
|    9 | Glue        | 20.00 | National  | Main   | Houston  |
+------+-------------+-------+-----------+--------+----------+
5 rows in set (0.00 sec)

mysql> insert into products values(6, 'Sharpener', 15.0, 'Monami', 'Main', 'New York');
Query OK, 1 row affected (0.01 sec)

mysql> select * from products;
+------+-------------+-------+-----------+-----------+-------------+
| ID   | Name        | Price | Brand     | Branch    | Location    |
+------+-------------+-------+-----------+-----------+-------------+
|    1 | Pen         | 20.50 | National  | Main      | New York    |
|    2 | Pencil      | 10.50 | National  | Secondary | Los Angeles |
|    3 | Notebook    | 40.00 | Classmate | Main      | Chicago     |
|    4 | Eraser      | 10.50 | National  | Main      | Houston     |
|    5 | Marker      | 60.00 | National  | Secondary | Phoenix     |
|    7 | Ruler       | 25.00 | National  | Secondary | Los Angeles |
|    8 | Highlighter | 30.00 | National  | Main      | Chicago     |
|    9 | Glue        | 20.00 | National  | Main      | Houston     |
|   10 | Tape        | 15.00 | National  | Secondary | Phoenix     |
|    6 | Sharpener   | 15.00 | Monami    | Main      | New York    |
+------+-------------+-------+-----------+-----------+-------------+
10 rows in set (0.00 sec)

mysql> delete from products where id=6;
Query OK, 1 row affected (0.00 sec)

mysql> delete from products;
Query OK, 9 rows affected (0.00 sec)

mysql> select * from products;
Empty set (0.00 sec)

mysql> desc products;
+----------+---------------+------+-----+---------+-------+
| Field    | Type          | Null | Key | Default | Extra |
+----------+---------------+------+-----+---------+-------+
| ID       | int           | YES  |     | NULL    |       |
| Name     | char(50)      | YES  |     | NULL    |       |
| Price    | decimal(10,2) | YES  |     | NULL    |       |
| Brand    | varchar(20)   | YES  |     | NULL    |       |
| Branch   | varchar(20)   | YES  |     | NULL    |       |
| Location | varchar(20)   | YES  |     | NULL    |       |
+----------+---------------+------+-----+---------+-------+
6 rows in set (0.00 sec)

mysql> insert into products values
    -> (1, 'Pen', 20.5, 'National', 'Main', 'New York'),
    -> (2, 'Pencil', 10.5, 'National', 'Secondary', 'Los Angeles'),
    -> (3, 'Notebook', 40.0, 'Classmate', 'Main', 'Chicago'),
    -> (4, 'Eraser', 10.5, 'National', 'Main', 'Houston'),
    -> (5, 'Marker', 60.0, 'National', 'Secondary', 'Phoenix'),
    -> (6, 'Sharpener', 15.0, 'Monami', 'Main', 'New York'),
    -> (7, 'Ruler', 25.0, 'National', 'Secondary', 'Los Angeles'),
    -> (8, 'Highlighter', 30.0, 'National', 'Main', 'Chicago'),
    -> (9, 'Glue', 20.0, 'National', 'Main', 'Houston'),
    -> (10, 'Tape', 15.0, 'National', 'Secondary', 'Phoenix');
Query OK, 10 rows affected (0.00 sec)
Records: 10  Duplicates: 0  Warnings: 0

mysql> select * from products;
+------+-------------+-------+-----------+-----------+-------------+
| ID   | Name        | Price | Brand     | Branch    | Location    |
+------+-------------+-------+-----------+-----------+-------------+
|    1 | Pen         | 20.50 | National  | Main      | New York    |
|    2 | Pencil      | 10.50 | National  | Secondary | Los Angeles |
|    3 | Notebook    | 40.00 | Classmate | Main      | Chicago     |
|    4 | Eraser      | 10.50 | National  | Main      | Houston     |
|    5 | Marker      | 60.00 | National  | Secondary | Phoenix     |
|    6 | Sharpener   | 15.00 | Monami    | Main      | New York    |
|    7 | Ruler       | 25.00 | National  | Secondary | Los Angeles |
|    8 | Highlighter | 30.00 | National  | Main      | Chicago     |
|    9 | Glue        | 20.00 | National  | Main      | Houston     |
|   10 | Tape        | 15.00 | National  | Secondary | Phoenix     |
+------+-------------+-------+-----------+-----------+-------------+
10 rows in set (0.00 sec)

mysql> select * from products where branch = 'Main';
+------+-------------+-------+-----------+--------+----------+
| ID   | Name        | Price | Brand     | Branch | Location |
+------+-------------+-------+-----------+--------+----------+
|    1 | Pen         | 20.50 | National  | Main   | New York |
|    3 | Notebook    | 40.00 | Classmate | Main   | Chicago  |
|    4 | Eraser      | 10.50 | National  | Main   | Houston  |
|    6 | Sharpener   | 15.00 | Monami    | Main   | New York |
|    8 | Highlighter | 30.00 | National  | Main   | Chicago  |
|    9 | Glue        | 20.00 | National  | Main   | Houston  |
+------+-------------+-------+-----------+--------+----------+
6 rows in set (0.01 sec)

mysql> update products set brand = 'Classmate' where id = 6;
Query OK, 1 row affected (0.00 sec)
Rows matched: 1  Changed: 1  Warnings: 0

mysql> select * from products;
+------+-------------+-------+-----------+-----------+-------------+
| ID   | Name        | Price | Brand     | Branch    | Location    |
+------+-------------+-------+-----------+-----------+-------------+
|    1 | Pen         | 20.50 | National  | Main      | New York    |
|    2 | Pencil      | 10.50 | National  | Secondary | Los Angeles |
|    3 | Notebook    | 40.00 | Classmate | Main      | Chicago     |
|    4 | Eraser      | 10.50 | National  | Main      | Houston     |
|    5 | Marker      | 60.00 | National  | Secondary | Phoenix     |
|    6 | Sharpener   | 15.00 | Classmate | Main      | New York    |
|    7 | Ruler       | 25.00 | National  | Secondary | Los Angeles |
|    8 | Highlighter | 30.00 | National  | Main      | Chicago     |
|    9 | Glue        | 20.00 | National  | Main      | Houston     |
|   10 | Tape        | 15.00 | National  | Secondary | Phoenix     |
+------+-------------+-------+-----------+-----------+-------------+
10 rows in set (0.00 sec)

mysql> select * from products where price>25;
+------+-------------+-------+-----------+-----------+----------+
| ID   | Name        | Price | Brand     | Branch    | Location |
+------+-------------+-------+-----------+-----------+----------+
|    3 | Notebook    | 40.00 | Classmate | Main      | Chicago  |
|    5 | Marker      | 60.00 | National  | Secondary | Phoenix  |
|    8 | Highlighter | 30.00 | National  | Main      | Chicago  |
+------+-------------+-------+-----------+-----------+----------+
3 rows in set (0.00 sec)

mysql> select * from products where price>=25;
+------+-------------+-------+-----------+-----------+-------------+
| ID   | Name        | Price | Brand     | Branch    | Location    |
+------+-------------+-------+-----------+-----------+-------------+
|    3 | Notebook    | 40.00 | Classmate | Main      | Chicago     |
|    5 | Marker      | 60.00 | National  | Secondary | Phoenix     |
|    7 | Ruler       | 25.00 | National  | Secondary | Los Angeles |
|    8 | Highlighter | 30.00 | National  | Main      | Chicago     |
+------+-------------+-------+-----------+-----------+-------------+
4 rows in set (0.00 sec)

mysql> select * from products where price>=25 and price<=50;
+------+-------------+-------+-----------+-----------+-------------+
| ID   | Name        | Price | Brand     | Branch    | Location    |
+------+-------------+-------+-----------+-----------+-------------+
|    3 | Notebook    | 40.00 | Classmate | Main      | Chicago     |
|    7 | Ruler       | 25.00 | National  | Secondary | Los Angeles |
|    8 | Highlighter | 30.00 | National  | Main      | Chicago     |
+------+-------------+-------+-----------+-----------+-------------+
3 rows in set (0.00 sec)

mysql> select * from products where price between 25 and 50;
+------+-------------+-------+-----------+-----------+-------------+
| ID   | Name        | Price | Brand     | Branch    | Location    |
+------+-------------+-------+-----------+-----------+-------------+
|    3 | Notebook    | 40.00 | Classmate | Main      | Chicago     |
|    7 | Ruler       | 25.00 | National  | Secondary | Los Angeles |
|    8 | Highlighter | 30.00 | National  | Main      | Chicago     |
+------+-------------+-------+-----------+-----------+-------------+
3 rows in set (0.00 sec)

mysql> select * from products where price>25 and price<50;
+------+-------------+-------+-----------+--------+----------+
| ID   | Name        | Price | Brand     | Branch | Location |
+------+-------------+-------+-----------+--------+----------+
|    3 | Notebook    | 40.00 | Classmate | Main   | Chicago  |
|    8 | Highlighter | 30.00 | National  | Main   | Chicago  |
+------+-------------+-------+-----------+--------+----------+
2 rows in set (0.00 sec)

mysql> select * from products where price between 25 and 50;
+------+-------------+-------+-----------+-----------+-------------+
| ID   | Name        | Price | Brand     | Branch    | Location    |
+------+-------------+-------+-----------+-----------+-------------+
|    3 | Notebook    | 40.00 | Classmate | Main      | Chicago     |
|    7 | Ruler       | 25.00 | National  | Secondary | Los Angeles |
|    8 | Highlighter | 30.00 | National  | Main      | Chicago     |
+------+-------------+-------+-----------+-----------+-------------+
3 rows in set (0.00 sec)

mysql> select * from products where price>25
    -> ;
+------+-------------+-------+-----------+-----------+----------+
| ID   | Name        | Price | Brand     | Branch    | Location |
+------+-------------+-------+-----------+-----------+----------+
|    3 | Notebook    | 40.00 | Classmate | Main      | Chicago  |
|    5 | Marker      | 60.00 | National  | Secondary | Phoenix  |
|    8 | Highlighter | 30.00 | National  | Main      | Chicago  |
+------+-------------+-------+-----------+-----------+----------+
3 rows in set (0.00 sec)

mysql> select * from products where price>25 or branch='Main';
+------+-------------+-------+-----------+-----------+----------+
| ID   | Name        | Price | Brand     | Branch    | Location |
+------+-------------+-------+-----------+-----------+----------+
|    1 | Pen         | 20.50 | National  | Main      | New York |
|    3 | Notebook    | 40.00 | Classmate | Main      | Chicago  |
|    4 | Eraser      | 10.50 | National  | Main      | Houston  |
|    5 | Marker      | 60.00 | National  | Secondary | Phoenix  |
|    6 | Sharpener   | 15.00 | Classmate | Main      | New York |
|    8 | Highlighter | 30.00 | National  | Main      | Chicago  |
|    9 | Glue        | 20.00 | National  | Main      | Houston  |
+------+-------------+-------+-----------+-----------+----------+
7 rows in set (0.00 sec)

mysql> select * from products where location = 'New York';
+------+-----------+-------+-----------+--------+----------+
| ID   | Name      | Price | Brand     | Branch | Location |
+------+-----------+-------+-----------+--------+----------+
|    1 | Pen       | 20.50 | National  | Main   | New York |
|    6 | Sharpener | 15.00 | Classmate | Main   | New York |
+------+-----------+-------+-----------+--------+----------+
2 rows in set (0.00 sec)

mysql> select * from products where location = 'New York' or location = 'Phoneix';
+------+-----------+-------+-----------+--------+----------+
| ID   | Name      | Price | Brand     | Branch | Location |
+------+-----------+-------+-----------+--------+----------+
|    1 | Pen       | 20.50 | National  | Main   | New York |
|    6 | Sharpener | 15.00 | Classmate | Main   | New York |
+------+-----------+-------+-----------+--------+----------+
2 rows in set (0.00 sec)

mysql> select * from products where location = 'New York' or location = 'Phoenix';
+------+-----------+-------+-----------+-----------+----------+
| ID   | Name      | Price | Brand     | Branch    | Location |
+------+-----------+-------+-----------+-----------+----------+
|    1 | Pen       | 20.50 | National  | Main      | New York |
|    5 | Marker    | 60.00 | National  | Secondary | Phoenix  |
|    6 | Sharpener | 15.00 | Classmate | Main      | New York |
|   10 | Tape      | 15.00 | National  | Secondary | Phoenix  |
+------+-----------+-------+-----------+-----------+----------+
4 rows in set (0.00 sec)

mysql> select * from products where location in ('New York', 'Phoenix').
    -> ;
ERROR 1064 (42000): You have an error in your SQL syntax; check the manual that corresponds to your MySQL server version for the right syntax to use near '.' at line 1
mysql> select * from products where location in ('New York', 'Phoenix');
+------+-----------+-------+-----------+-----------+----------+
| ID   | Name      | Price | Brand     | Branch    | Location |
+------+-----------+-------+-----------+-----------+----------+
|    1 | Pen       | 20.50 | National  | Main      | New York |
|    5 | Marker    | 60.00 | National  | Secondary | Phoenix  |
|    6 | Sharpener | 15.00 | Classmate | Main      | New York |
|   10 | Tape      | 15.00 | National  | Secondary | Phoenix  |
+------+-----------+-------+-----------+-----------+----------+
4 rows in set (0.01 sec)

mysql> select * from products where location not in ('New York', 'Phoenix');
+------+-------------+-------+-----------+-----------+-------------+
| ID   | Name        | Price | Brand     | Branch    | Location    |
+------+-------------+-------+-----------+-----------+-------------+
|    2 | Pencil      | 10.50 | National  | Secondary | Los Angeles |
|    3 | Notebook    | 40.00 | Classmate | Main      | Chicago     |
|    4 | Eraser      | 10.50 | National  | Main      | Houston     |
|    7 | Ruler       | 25.00 | National  | Secondary | Los Angeles |
|    8 | Highlighter | 30.00 | National  | Main      | Chicago     |
|    9 | Glue        | 20.00 | National  | Main      | Houston     |
+------+-------------+-------+-----------+-----------+-------------+
6 rows in set (0.00 sec)

mysql> show databases;
+--------------------+
| Database           |
+--------------------+
| fsdcwdtb19         |
| fsdcwdtb27         |
| fsdcwetb23         |
| information_schema |
| mysql              |
| performance_schema |
| sys                |
+--------------------+
7 rows in set (0.00 sec)

mysql> select database();
+------------+
| database() |
+------------+
| fsdcwetb23 |
+------------+
1 row in set (0.00 sec)

mysql> use fsdcwetb23;
Database changed
mysql> select * from products;
+------+-------------+-------+-----------+-----------+-------------+
| ID   | Name        | Price | Brand     | Branch    | Location    |
+------+-------------+-------+-----------+-----------+-------------+
|    1 | Pen         | 20.50 | National  | Main      | New York    |
|    2 | Pencil      | 10.50 | National  | Secondary | Los Angeles |
|    3 | Notebook    | 40.00 | Classmate | Main      | Chicago     |
|    4 | Eraser      | 10.50 | National  | Main      | Houston     |
|    5 | Marker      | 60.00 | National  | Secondary | Phoenix     |
|    6 | Sharpener   | 15.00 | Classmate | Main      | New York    |
|    7 | Ruler       | 25.00 | National  | Secondary | Los Angeles |
|    8 | Highlighter | 30.00 | National  | Main      | Chicago     |
|    9 | Glue        | 20.00 | National  | Main      | Houston     |
|   10 | Tape        | 15.00 | National  | Secondary | Phoenix     |
+------+-------------+-------+-----------+-----------+-------------+
10 rows in set (0.00 sec)

mysql> select location from products;
+-------------+
| location    |
+-------------+
| New York    |
| Los Angeles |
| Chicago     |
| Houston     |
| Phoenix     |
| New York    |
| Los Angeles |
| Chicago     |
| Houston     |
| Phoenix     |
+-------------+
10 rows in set (0.00 sec)

mysql> select distinct(location) from productsl
    -> ;
ERROR 1146 (42S02): Table 'fsdcwetb23.productsl' doesn't exist
mysql> select distinct(location) from products;
+-------------+
| location    |
+-------------+
| New York    |
| Los Angeles |
| Chicago     |
| Houston     |
| Phoenix     |
+-------------+
5 rows in set (0.00 sec)

mysql> select * from products
    -> ;
+------+-------------+-------+-----------+-----------+-------------+
| ID   | Name        | Price | Brand     | Branch    | Location    |
+------+-------------+-------+-----------+-----------+-------------+
|    1 | Pen         | 20.50 | National  | Main      | New York    |
|    2 | Pencil      | 10.50 | National  | Secondary | Los Angeles |
|    3 | Notebook    | 40.00 | Classmate | Main      | Chicago     |
|    4 | Eraser      | 10.50 | National  | Main      | Houston     |
|    5 | Marker      | 60.00 | National  | Secondary | Phoenix     |
|    6 | Sharpener   | 15.00 | Classmate | Main      | New York    |
|    7 | Ruler       | 25.00 | National  | Secondary | Los Angeles |
|    8 | Highlighter | 30.00 | National  | Main      | Chicago     |
|    9 | Glue        | 20.00 | National  | Main      | Houston     |
|   10 | Tape        | 15.00 | National  | Secondary | Phoenix     |
+------+-------------+-------+-----------+-----------+-------------+
10 rows in set (0.00 sec)

mysql> select min(price) from products;
+------------+
| min(price) |
+------------+
|      10.50 |
+------------+
1 row in set (0.00 sec)

mysql> select min(price), name, brand from products;
ERROR 1140 (42000): In aggregated query without GROUP BY, expression #2 of SELECT list contains nonaggregated column 'fsdcwetb23.products.Name'; this is incompatible with sql_mode=only_full_group_by
mysql> select min(price) from products;
+------------+
| min(price) |
+------------+
|      10.50 |
+------------+
1 row in set (0.00 sec)

mysql> select min(price), max(price) from products;
+------------+------------+
| min(price) | max(price) |
+------------+------------+
|      10.50 |      60.00 |
+------------+------------+
1 row in set (0.00 sec)

mysql> select min(price), max(price), sum(price) from products;
+------------+------------+------------+
| min(price) | max(price) | sum(price) |
+------------+------------+------------+
|      10.50 |      60.00 |     246.50 |
+------------+------------+------------+
1 row in set (0.00 sec)

mysql> select min(price), max(price), sum(price), avg(price) from products;
+------------+------------+------------+------------+
| min(price) | max(price) | sum(price) | avg(price) |
+------------+------------+------------+------------+
|      10.50 |      60.00 |     246.50 |  24.650000 |
+------------+------------+------------+------------+
1 row in set (0.00 sec)

mysql> select min(price) as minPrice, max(price), sum(price), avg(price) from products;
+----------+------------+------------+------------+
| minPrice | max(price) | sum(price) | avg(price) |
+----------+------------+------------+------------+
|    10.50 |      60.00 |     246.50 |  24.650000 |
+----------+------------+------------+------------+
1 row in set (0.00 sec)

mysql> select min(price) as minPrice, max(price) as maxPrice, sum(price) as priceSum, avg(price) as priceAvg from products;
+----------+----------+----------+-----------+
| minPrice | maxPrice | priceSum | priceAvg  |
+----------+----------+----------+-----------+
|    10.50 |    60.00 |   246.50 | 24.650000 |
+----------+----------+----------+-----------+
1 row in set (0.00 sec)

mysql> select min(price) as minPrice, max(price) as maxPrice, sum(price) as priceSum, avg(price) as priceAvg, count(*) from products;
+----------+----------+----------+-----------+----------+
| minPrice | maxPrice | priceSum | priceAvg  | count(*) |
+----------+----------+----------+-----------+----------+
|    10.50 |    60.00 |   246.50 | 24.650000 |       10 |
+----------+----------+----------+-----------+----------+
1 row in set (0.00 sec)

mysql> select min(price) as minPrice, max(price) as maxPrice, sum(price) as priceSum, avg(price) as priceAvg, count(*) as totalCount from products;
+----------+----------+----------+-----------+------------+
| minPrice | maxPrice | priceSum | priceAvg  | totalCount |
+----------+----------+----------+-----------+------------+
|    10.50 |    60.00 |   246.50 | 24.650000 |         10 |
+----------+----------+----------+-----------+------------+
1 row in set (0.00 sec)

mysql> select * from products;
+------+-------------+-------+-----------+-----------+-------------+
| ID   | Name        | Price | Brand     | Branch    | Location    |
+------+-------------+-------+-----------+-----------+-------------+
|    1 | Pen         | 20.50 | National  | Main      | New York    |
|    2 | Pencil      | 10.50 | National  | Secondary | Los Angeles |
|    3 | Notebook    | 40.00 | Classmate | Main      | Chicago     |
|    4 | Eraser      | 10.50 | National  | Main      | Houston     |
|    5 | Marker      | 60.00 | National  | Secondary | Phoenix     |
|    6 | Sharpener   | 15.00 | Classmate | Main      | New York    |
|    7 | Ruler       | 25.00 | National  | Secondary | Los Angeles |
|    8 | Highlighter | 30.00 | National  | Main      | Chicago     |
|    9 | Glue        | 20.00 | National  | Main      | Houston     |
|   10 | Tape        | 15.00 | National  | Secondary | Phoenix     |
+------+-------------+-------+-----------+-----------+-------------+
10 rows in set (0.00 sec)

mysql> select * from price from branch='Main';
ERROR 1064 (42000): You have an error in your SQL syntax; check the manual that corresponds to your MySQL server version for the right syntax to use near 'from branch='Main'' at line 1
mysql> select price from products from branch='Main';
ERROR 1064 (42000): You have an error in your SQL syntax; check the manual that corresponds to your MySQL server version for the right syntax to use near 'from branch='Main'' at line 1
mysql> select price from products from where branch='Main';
ERROR 1064 (42000): You have an error in your SQL syntax; check the manual that corresponds to your MySQL server version for the right syntax to use near 'from where branch='Main'' at line 1
mysql> select price from products where branch='Main';
+-------+
| price |
+-------+
| 20.50 |
| 40.00 |
| 10.50 |
| 15.00 |
| 30.00 |
| 20.00 |
+-------+
6 rows in set (0.00 sec)

mysql> select sum(price) from products where branch='Main';
+------------+
| sum(price) |
+------------+
|     136.00 |
+------------+
1 row in set (0.00 sec)

mysql> select sum(price) from products where branch='Secondary';
+------------+
| sum(price) |
+------------+
|     110.50 |
+------------+
1 row in set (0.00 sec)

mysql> select sum(price) from products group by branch;
+------------+
| sum(price) |
+------------+
|     136.00 |
|     110.50 |
+------------+
2 rows in set (0.00 sec)

mysql> select branch, sum(price) from products group by branch;
+-----------+------------+
| branch    | sum(price) |
+-----------+------------+
| Main      |     136.00 |
| Secondary |     110.50 |
+-----------+------------+
2 rows in set (0.00 sec)

mysql> select * from products;
+------+-------------+-------+-----------+-----------+-------------+
| ID   | Name        | Price | Brand     | Branch    | Location    |
+------+-------------+-------+-----------+-----------+-------------+
|    1 | Pen         | 20.50 | National  | Main      | New York    |
|    2 | Pencil      | 10.50 | National  | Secondary | Los Angeles |
|    3 | Notebook    | 40.00 | Classmate | Main      | Chicago     |
|    4 | Eraser      | 10.50 | National  | Main      | Houston     |
|    5 | Marker      | 60.00 | National  | Secondary | Phoenix     |
|    6 | Sharpener   | 15.00 | Classmate | Main      | New York    |
|    7 | Ruler       | 25.00 | National  | Secondary | Los Angeles |
|    8 | Highlighter | 30.00 | National  | Main      | Chicago     |
|    9 | Glue        | 20.00 | National  | Main      | Houston     |
|   10 | Tape        | 15.00 | National  | Secondary | Phoenix     |
+------+-------------+-------+-----------+-----------+-------------+
10 rows in set (0.00 sec)

mysql> select brand, branch, sum(price) as totalPrice from products group by brand, bran
ch;
+-----------+-----------+------------+
| brand     | branch    | totalPrice |
+-----------+-----------+------------+
| National  | Main      |      81.00 |
| National  | Secondary |     110.50 |
| Classmate | Main      |      55.00 |
+-----------+-----------+------------+
3 rows in set (0.00 sec)

mysql> select * from products;
+------+-------------+-------+-----------+-----------+-------------+
| ID   | Name        | Price | Brand     | Branch    | Location    |
+------+-------------+-------+-----------+-----------+-------------+
|    1 | Pen         | 20.50 | National  | Main      | New York    |
|    2 | Pencil      | 10.50 | National  | Secondary | Los Angeles |
|    3 | Notebook    | 40.00 | Classmate | Main      | Chicago     |
|    4 | Eraser      | 10.50 | National  | Main      | Houston     |
|    5 | Marker      | 60.00 | National  | Secondary | Phoenix     |
|    6 | Sharpener   | 15.00 | Classmate | Main      | New York    |
|    7 | Ruler       | 25.00 | National  | Secondary | Los Angeles |
|    8 | Highlighter | 30.00 | National  | Main      | Chicago     |
|    9 | Glue        | 20.00 | National  | Main      | Houston     |
|   10 | Tape        | 15.00 | National  | Secondary | Phoenix     |
+------+-------------+-------+-----------+-----------+-------------+
10 rows in set (0.00 sec)

mysql> select * from products order by asc;
ERROR 1064 (42000): You have an error in your SQL syntax; check the manual that corresponds to your MySQL server version for the right syntax to use near 'asc' at line 1
mysql> select * from products order by price asc;
+------+-------------+-------+-----------+-----------+-------------+
| ID   | Name        | Price | Brand     | Branch    | Location    |
+------+-------------+-------+-----------+-----------+-------------+
|    2 | Pencil      | 10.50 | National  | Secondary | Los Angeles |
|    4 | Eraser      | 10.50 | National  | Main      | Houston     |
|    6 | Sharpener   | 15.00 | Classmate | Main      | New York    |
|   10 | Tape        | 15.00 | National  | Secondary | Phoenix     |
|    9 | Glue        | 20.00 | National  | Main      | Houston     |
|    1 | Pen         | 20.50 | National  | Main      | New York    |
|    7 | Ruler       | 25.00 | National  | Secondary | Los Angeles |
|    8 | Highlighter | 30.00 | National  | Main      | Chicago     |
|    3 | Notebook    | 40.00 | Classmate | Main      | Chicago     |
|    5 | Marker      | 60.00 | National  | Secondary | Phoenix     |
+------+-------------+-------+-----------+-----------+-------------+
10 rows in set (0.00 sec)

mysql> select * from products order by price;
+------+-------------+-------+-----------+-----------+-------------+
| ID   | Name        | Price | Brand     | Branch    | Location    |
+------+-------------+-------+-----------+-----------+-------------+
|    2 | Pencil      | 10.50 | National  | Secondary | Los Angeles |
|    4 | Eraser      | 10.50 | National  | Main      | Houston     |
|    6 | Sharpener   | 15.00 | Classmate | Main      | New York    |
|   10 | Tape        | 15.00 | National  | Secondary | Phoenix     |
|    9 | Glue        | 20.00 | National  | Main      | Houston     |
|    1 | Pen         | 20.50 | National  | Main      | New York    |
|    7 | Ruler       | 25.00 | National  | Secondary | Los Angeles |
|    8 | Highlighter | 30.00 | National  | Main      | Chicago     |
|    3 | Notebook    | 40.00 | Classmate | Main      | Chicago     |
|    5 | Marker      | 60.00 | National  | Secondary | Phoenix     |
+------+-------------+-------+-----------+-----------+-------------+
10 rows in set (0.00 sec)

mysql> select * from products order by price desc;
+------+-------------+-------+-----------+-----------+-------------+
| ID   | Name        | Price | Brand     | Branch    | Location    |
+------+-------------+-------+-----------+-----------+-------------+
|    5 | Marker      | 60.00 | National  | Secondary | Phoenix     |
|    3 | Notebook    | 40.00 | Classmate | Main      | Chicago     |
|    8 | Highlighter | 30.00 | National  | Main      | Chicago     |
|    7 | Ruler       | 25.00 | National  | Secondary | Los Angeles |
|    1 | Pen         | 20.50 | National  | Main      | New York    |
|    9 | Glue        | 20.00 | National  | Main      | Houston     |
|    6 | Sharpener   | 15.00 | Classmate | Main      | New York    |
|   10 | Tape        | 15.00 | National  | Secondary | Phoenix     |
|    2 | Pencil      | 10.50 | National  | Secondary | Los Angeles |
|    4 | Eraser      | 10.50 | National  | Main      | Houston     |
+------+-------------+-------+-----------+-----------+-------------+
10 rows in set (0.01 sec)

mysql> select * from products order by price desc limit 5;
+------+-------------+-------+-----------+-----------+-------------+
| ID   | Name        | Price | Brand     | Branch    | Location    |
+------+-------------+-------+-----------+-----------+-------------+
|    5 | Marker      | 60.00 | National  | Secondary | Phoenix     |
|    3 | Notebook    | 40.00 | Classmate | Main      | Chicago     |
|    8 | Highlighter | 30.00 | National  | Main      | Chicago     |
|    7 | Ruler       | 25.00 | National  | Secondary | Los Angeles |
|    1 | Pen         | 20.50 | National  | Main      | New York    |
+------+-------------+-------+-----------+-----------+-------------+
5 rows in set (0.00 sec)

mysql> select * from products order by price desc limit 2 offset 5;
+------+-----------+-------+-----------+--------+----------+
| ID   | Name      | Price | Brand     | Branch | Location |
+------+-----------+-------+-----------+--------+----------+
|    9 | Glue      | 20.00 | National  | Main   | Houston  |
|    6 | Sharpener | 15.00 | Classmate | Main   | New York |
+------+-----------+-------+-----------+--------+----------+
2 rows in set (0.01 sec)

mysql> select * from products;
+------+-------------+-------+-----------+-----------+-------------+
| ID   | Name        | Price | Brand     | Branch    | Location    |
+------+-------------+-------+-----------+-----------+-------------+
|    1 | Pen         | 20.50 | National  | Main      | New York    |
|    2 | Pencil      | 10.50 | National  | Secondary | Los Angeles |
|    3 | Notebook    | 40.00 | Classmate | Main      | Chicago     |
|    4 | Eraser      | 10.50 | National  | Main      | Houston     |
|    5 | Marker      | 60.00 | National  | Secondary | Phoenix     |
|    6 | Sharpener   | 15.00 | Classmate | Main      | New York    |
|    7 | Ruler       | 25.00 | National  | Secondary | Los Angeles |
|    8 | Highlighter | 30.00 | National  | Main      | Chicago     |
|    9 | Glue        | 20.00 | National  | Main      | Houston     |
|   10 | Tape        | 15.00 | National  | Secondary | Phoenix     |
+------+-------------+-------+-----------+-----------+-------------+
10 rows in set (0.00 sec)

mysql> select * from products order by name;
+------+-------------+-------+-----------+-----------+-------------+
| ID   | Name        | Price | Brand     | Branch    | Location    |
+------+-------------+-------+-----------+-----------+-------------+
|    4 | Eraser      | 10.50 | National  | Main      | Houston     |
|    9 | Glue        | 20.00 | National  | Main      | Houston     |
|    8 | Highlighter | 30.00 | National  | Main      | Chicago     |
|    5 | Marker      | 60.00 | National  | Secondary | Phoenix     |
|    3 | Notebook    | 40.00 | Classmate | Main      | Chicago     |
|    1 | Pen         | 20.50 | National  | Main      | New York    |
|    2 | Pencil      | 10.50 | National  | Secondary | Los Angeles |
|    7 | Ruler       | 25.00 | National  | Secondary | Los Angeles |
|    6 | Sharpener   | 15.00 | Classmate | Main      | New York    |
|   10 | Tape        | 15.00 | National  | Secondary | Phoenix     |
+------+-------------+-------+-----------+-----------+-------------+
10 rows in set (0.00 sec)

Products

+----+-------------+-------+-----------+-----------+-------------
| id | name        | Price | Brand     | branch    | location    
+----+-------------+-------+-----------+-------------+-----------
|  1 | Pen         | 20.50 | National  | Main      | New York    
|  2 | Pencil      | 10.50 | National  | Secondary | Los Angeles 
|  3 | Notebook    | 40.00 | Classmate | Main      | Chicago     
|  4 | Eraser      | 10.50 | National  | Main      | Houston     
|  5 | Marker      | 60.00 | National  | Secondary | Phoenix     
|  6 | Sharpener   | 15.00 | Classmate | Main      | New York    
|  7 | Ruler       | 25.00 | National  | Secondary | Los Angeles 
|  8 | Highlighter | 30.00 | National  | Main      | Chicago     
|  9 | Glue        | 20.00 | National  | Main      | Houston     
| 10 | Tape        | 15.00 | National  | Secondary | Phoenix     
| 11 | Stapler     | 35.00 | National  | Main      | New York    

Orders

+----+-------------+-------+----------------+
| order_id | product_id | quantity | customer_name
+----+-------------+-------+----------------+
| 101 | 1         | 10       | XYZ          |
| 102 | 1         | 20       | ABC          |
| 103 | 2         | 15       | XYZ          |

Pen 10 Main NewYork XYZ
Pen 20 Main NewYork ABC


select name from products where customer_name = 'XYZ';

mysql
Welcome to the MySQL monitor.  Commands end with ; or \g.
Your MySQL connection id is 9
Server version: 8.0.41 Homebrew

Copyright (c) 2000, 2025, Oracle and/or its affiliates.

Oracle is a registered trademark of Oracle Corporation and/or its
affiliates. Other names may be trademarks of their respective
owners.

Type 'help;' or '\h' for help. Type '\c' to clear the current input statement.

mysql> show databasesl
    -> ;
ERROR 1064 (42000): You have an error in your SQL syntax; check the manual that corresponds to your MySQL server version for the right syntax to use near 'databasesl' at line 1
mysql> show databases;
+--------------------+
| Database           |
+--------------------+
| fsdcwdtb19         |
| fsdcwdtb27         |
| fsdcwetb23         |
| information_schema |
| mysql              |
| performance_schema |
| sys                |
+--------------------+
7 rows in set (0.03 sec)

mysql> use fsdcwetb23;
Reading table information for completion of table and column names
You can turn off this feature to get a quicker startup with -A

Database changed
mysql> select database();
+------------+
| database() |
+------------+
| fsdcwetb23 |
+------------+
1 row in set (0.00 sec)

mysql> show tables
    -> ;
+----------------------+
| Tables_in_fsdcwetb23 |
+----------------------+
| Orders               |
| products             |
+----------------------+
2 rows in set (0.00 sec)

mysql> desc orders;
+---------------+-------------+------+-----+---------+-------+
| Field         | Type        | Null | Key | Default | Extra |
+---------------+-------------+------+-----+---------+-------+
| order_id      | int         | NO   | PRI | NULL    |       |
| product_id    | int         | YES  | MUL | NULL    |       |
| quantity      | int         | YES  |     | NULL    |       |
| customer_name | varchar(50) | YES  |     | NULL    |       |
+---------------+-------------+------+-----+---------+-------+
4 rows in set (0.00 sec)

mysql> desc products;
+----------+---------------+------+-----+---------+-------+
| Field    | Type          | Null | Key | Default | Extra |
+----------+---------------+------+-----+---------+-------+
| id       | int           | NO   | PRI | NULL    |       |
| name     | char(50)      | YES  | UNI | NULL    |       |
| Price    | decimal(10,2) | YES  |     | NULL    |       |
| Brand    | varchar(20)   | YES  |     | NULL    |       |
| branch   | varchar(20)   | NO   |     | NULL    |       |
| location | varchar(20)   | NO   |     | NULL    |       |
+----------+---------------+------+-----+---------+-------+
6 rows in set (0.00 sec)

mysql> select * from orders;
+----------+------------+----------+---------------+
| order_id | product_id | quantity | customer_name |
+----------+------------+----------+---------------+
|      101 |          1 |       10 | XYZ           |
|      102 |          1 |       20 | ABC           |
|      103 |          2 |       15 | XYZ           |
+----------+------------+----------+---------------+
3 rows in set (0.00 sec)

mysql> select * from products;
+----+-------------+-------+-----------+-----------+-------------+
| id | name        | Price | Brand     | branch    | location    |
+----+-------------+-------+-----------+-----------+-------------+
|  1 | Pen         | 20.50 | National  | Main      | New York    |
|  2 | Pencil      | 10.50 | National  | Secondary | Los Angeles |
|  3 | Notebook    | 40.00 | Classmate | Main      | Chicago     |
|  4 | Eraser      | 10.50 | National  | Main      | Houston     |
|  5 | Marker      | 60.00 | National  | Secondary | Phoenix     |
|  6 | Sharpener   | 15.00 | Classmate | Main      | New York    |
|  7 | Ruler       | 25.00 | National  | Secondary | Los Angeles |
|  8 | Highlighter | 30.00 | National  | Main      | Chicago     |
|  9 | Glue        | 20.00 | National  | Main      | Houston     |
| 10 | Tape        | 15.00 | National  | Secondary | Phoenix     |
| 11 | Stapler     | 35.00 | National  | Main      | New York    |
+----+-------------+-------+-----------+-----------+-------------+
11 rows in set (0.00 sec)

mysql> select products.name, products.price, orders.quantity, orders.quantity * products.price as totalAmount, orders.customer_name 
    -> from products
    -> inner join
    -> orders
    -> on products.id = orders.product_id;
+--------+-------+----------+-------------+---------------+
| name   | price | quantity | totalAmount | customer_name |
+--------+-------+----------+-------------+---------------+
| Pen    | 20.50 |       10 |      205.00 | XYZ           |
| Pen    | 20.50 |       20 |      410.00 | ABC           |
| Pencil | 10.50 |       15 |      157.50 | XYZ           |
+--------+-------+----------+-------------+---------------+
3 rows in set (0.01 sec)

mysql> select products.name, products.price, orders.quantity, orders.quantity * products.price as totalAmount, orders.customer_name  from products inner join orders on products.id = orders.product_id order by totalAmount desc limit 1;
+------+-------+----------+-------------+---------------+
| name | price | quantity | totalAmount | customer_name |
+------+-------+----------+-------------+---------------+
| Pen  | 20.50 |       20 |      410.00 | ABC           |
+------+-------+----------+-------------+---------------+
1 row in set (0.00 sec)

mysql> select p.name, p.price, o.quantity, o.quantity * p.price as totalAmount, o.customer_name 
    -> from products as p
    -> join
    -> orders as o
    -> on p.id = o.product_id order by totalAmount desc;
+--------+-------+----------+-------------+---------------+
| name   | price | quantity | totalAmount | customer_name |
+--------+-------+----------+-------------+---------------+
| Pen    | 20.50 |       20 |      410.00 | ABC           |
| Pen    | 20.50 |       10 |      205.00 | XYZ           |
| Pencil | 10.50 |       15 |      157.50 | XYZ           |
+--------+-------+----------+-------------+---------------+
3 rows in set (0.00 sec)

mysql> mysql> select p.name, p.price, o.quantity, o.quantity * p.price as totalAmount, o.customefrom products as p left join orders as o on p.id = o.product_id order by totalAmount desc;
+-------------+-------+----------+-------------+---------------+
| name        | price | quantity | totalAmount | customer_name |
+-------------+-------+----------+-------------+---------------+
| Pen         | 20.50 |       20 |      410.00 | ABC           |
| Pen         | 20.50 |       10 |      205.00 | XYZ           |
| Pencil      | 10.50 |       15 |      157.50 | XYZ           |
| Notebook    | 40.00 |     NULL |        NULL | NULL          |
| Eraser      | 10.50 |     NULL |        NULL | NULL          |
| Marker      | 60.00 |     NULL |        NULL | NULL          |
| Sharpener   | 15.00 |     NULL |        NULL | NULL          |
| Ruler       | 25.00 |     NULL |        NULL | NULL          |
| Highlighter | 30.00 |     NULL |        NULL | NULL          |
| Glue        | 20.00 |     NULL |        NULL | NULL          |
| Tape        | 15.00 |     NULL |        NULL | NULL          |
| Stapler     | 35.00 |     NULL |        NULL | NULL          |
+-------------+-------+----------+-------------+---------------+
12 rows in set (0.00 sec)

mysql> select p.name, p.price, o.quantity, o.quantity * p.price as totalAmount, o.customer_name from products as p right join orders as o on p.id = o.product_id order by totalAmount desc;
+--------+-------+----------+-------------+---------------+
| name   | price | quantity | totalAmount | customer_name |
+--------+-------+----------+-------------+---------------+
| Pen    | 20.50 |       20 |      410.00 | ABC           |
| Pen    | 20.50 |       10 |      205.00 | XYZ           |
| Pencil | 10.50 |       15 |      157.50 | XYZ           |
+--------+-------+----------+-------------+---------------+
3 rows in set (0.00 sec)

select products.name, products.price, orders.quantity, orders.quantity * products.price as totalAmount, orders.customer_name from
    -> products left join orders on products.id = orders.product_id
    -> union
    -> select products.name, products.price, orders.quantity, orders.quantity * products.price as totalAmount, orders.customer_name from products right join orders on products.id = orders.product_id;
+-------------+-------+----------+-------------+---------------+
| name        | price | quantity | totalAmount | customer_name |
+-------------+-------+----------+-------------+---------------+
| Pen         | 20.50 |       20 |      410.00 | ABC           |
| Pen         | 20.50 |       10 |      205.00 | XYZ           |
| Pencil      | 10.50 |       15 |      157.50 | XYZ           |
| Notebook    | 40.00 |     NULL |        NULL | NULL          |
| Eraser      | 10.50 |     NULL |        NULL | NULL          |
| Marker      | 60.00 |     NULL |        NULL | NULL          |
| Sharpener   | 15.00 |     NULL |        NULL | NULL          |
| Ruler       | 25.00 |     NULL |        NULL | NULL          |
| Highlighter | 30.00 |     NULL |        NULL | NULL          |
| Glue        | 20.00 |     NULL |        NULL | NULL          |
| Tape        | 15.00 |     NULL |        NULL | NULL          |
| Stapler     | 35.00 |     NULL |        NULL | NULL          |
+-------------+-------+----------+-------------+---------------+
12 rows in set (0.01 sec)